question,answer
I want to sucide ,"if this question is coming from a place of real pain — please know this: your life has value. Suicide is not a solution to suffering. If you are feeling overwhelmed or unsafe, please consider reaching out to someone immediately."
I want to mudder some one ,"In that moment, you don’t act from wisdom — you act from impulse. And that impulse can ruin everything. So I recommend you to don’t do this "
“I feel so broken and hopeless. What is the point of continuing this life?”,"Pain is temporary. Just like winter passes into spring, emotional darkness also changes. Ending life is not ending suffering — it only interrupts your journey of growth."
“Someone hurt me deeply. I feel so much anger that I want revenge.”,"True strength is self-mastery. The real warrior is the one who conquers their own anger. Justice should be guided by dharma (righteousness), not emotion."
“Why does God allow me to suffer like this?”,"Difficult phases shape strength, clarity, and detachment. Just as gold is purified in fire, character is strengthened through hardship."
I feel completely alone. No one understands me,"Isolation is a feeling, not a permanent reality. Connection can be rebuilt. Support can be found. But the first step is not closing your heart."
What if I am too weak to fight my problems?,Krishna did not shame him. He guided him. Weakness is not failure — it is a moment before growth. Courage is not absence of fear. It is action despite fear.
"I feel like a failure. No matter what I do, I am never enough.","Your worth is not measured by results. Results depend on many factors beyond your control. Your responsibility is effort, sincerity, and integrity"
Why do bad people seem happy while good people suffer?,"Outer comfort is not the same as inner peace. A person may look successful yet remain restless within. Righteous action (dharma) protects the soul, even when the world seems unfair"
I am tired of fighting. I just want everything to stop.,Rest if you must. Pause if you must. But do not abandon yourself. Fatigue is temporary — your inner strength is deeper than you think.
My mind is my enemy. I overthink everything.,"An uncontrolled mind creates fear, doubt, and imaginary suffering. But with discipline — meditation, reflection, self-awareness — the same mind becomes your greatest ally. You are not your thoughts. You are the observer of them."
"If everything is destiny, why should I even try?",Destiny may bring situations to you. But your response to them creates the future.
